_id,text
62073693,trying wrtie two txtfiles test txt test txt csvfile row col getting single double quotes get rid csvfie nr col col col col col col col remark test test tested python test test tested python test test tested python test test tested python test test tested python test test tested python test test tested python expected ouput type nr test col col col col remark test tested python mycode import os import pandas pd pd options mode chained assignment none df pd read csv r c users desktop test map test mycsv v csv sep index col nr df col df col map f format df col df col map f format df col df col map f format df col df col map f format ans x pd dataframe x df groupby df index index true print ans table ans line table iloc print line line type line nr table col table col col col sort values col ascending true print col row range len col print row line str col values row none line none col table remark str split col table remark str split line remark str col values line remark str col values line line type nr col col col col str col values remark n col values col values line csv table txt sep myoutput type nr test col col col col remark test tested python
62073724,train model using linear regression used print confusion matrix classification report understanding read understand values model much accurate confusion matrix classification report precision recall f score support accuracy macro avg weighted avg
62073806,completely preprocess mnist dataset feeding cnn tried many preprocessing tricks nothing happens making mad want know easy preprocess steps little explanation please help
62073823,webratio javhttps registry hub docker com r webratio java aws cli dockerfilecan someone suggest best way run got error
62074040,following dataframe df index df date df groupby df index month df category amount sum date category amount b b would like report sum amount every category b like date category amount b b tried df get group method method needs tuple contains date category key way filter categories b
